{
  "$comment": "Generated by `gwylio schema` from the Pydantic models registered in backend/src/gwylio/infrastructure/config/schemas.py. Do not edit by hand.",
  "$defs": {
    "EnumValue": {
      "additionalProperties": false,
      "description": "One value of a closed vocabulary, with its label and what it means.",
      "properties": {
        "label": {
          "title": "Label",
          "type": "string"
        },
        "meaning": {
          "anyOf": [
            {
              "type": "string"
            },
            {
              "type": "null"
            }
          ],
          "title": "Meaning"
        },
        "value": {
          "description": "The stored value; credibility digits are written 1 to 6.",
          "title": "Value",
          "type": "string"
        }
      },
      "required": [
        "value",
        "label",
        "meaning"
      ],
      "title": "EnumValue",
      "type": "object"
    }
  },
  "$id": "snapshot-enums.schema.json",
  "$schema": "https://json-schema.org/draft/2020-12/schema",
  "additionalProperties": false,
  "description": "enums.json, GET /api/v1/meta/enums: every closed vocabulary, for legends and filters.",
  "properties": {
    "blind_spot_rule": {
      "description": "The standing sentence that a blind spot is not quiet.",
      "title": "Blind Spot Rule",
      "type": "string"
    },
    "bucket": {
      "items": {
        "$ref": "#/$defs/EnumValue"
      },
      "title": "Bucket",
      "type": "array"
    },
    "coverage_status": {
      "items": {
        "$ref": "#/$defs/EnumValue"
      },
      "title": "Coverage Status",
      "type": "array"
    },
    "credibility": {
      "items": {
        "$ref": "#/$defs/EnumValue"
      },
      "title": "Credibility",
      "type": "array"
    },
    "direction": {
      "items": {
        "$ref": "#/$defs/EnumValue"
      },
      "title": "Direction",
      "type": "array"
    },
    "discipline": {
      "items": {
        "$ref": "#/$defs/EnumValue"
      },
      "title": "Discipline",
      "type": "array"
    },
    "disposition_outcome": {
      "items": {
        "$ref": "#/$defs/EnumValue"
      },
      "title": "Disposition Outcome",
      "type": "array"
    },
    "finding_kind": {
      "items": {
        "$ref": "#/$defs/EnumValue"
      },
      "title": "Finding Kind",
      "type": "array"
    },
    "group_kind": {
      "items": {
        "$ref": "#/$defs/EnumValue"
      },
      "title": "Group Kind",
      "type": "array"
    },
    "history_kind": {
      "items": {
        "$ref": "#/$defs/EnumValue"
      },
      "title": "History Kind",
      "type": "array"
    },
    "indicator_state": {
      "items": {
        "$ref": "#/$defs/EnumValue"
      },
      "title": "Indicator State",
      "type": "array"
    },
    "lens": {
      "items": {
        "$ref": "#/$defs/EnumValue"
      },
      "title": "Lens",
      "type": "array"
    },
    "product_level": {
      "items": {
        "$ref": "#/$defs/EnumValue"
      },
      "title": "Product Level",
      "type": "array"
    },
    "reliability": {
      "items": {
        "$ref": "#/$defs/EnumValue"
      },
      "title": "Reliability",
      "type": "array"
    },
    "report_type": {
      "items": {
        "$ref": "#/$defs/EnumValue"
      },
      "title": "Report Type",
      "type": "array"
    },
    "run_status": {
      "items": {
        "$ref": "#/$defs/EnumValue"
      },
      "title": "Run Status",
      "type": "array"
    },
    "scanability": {
      "items": {
        "$ref": "#/$defs/EnumValue"
      },
      "title": "Scanability",
      "type": "array"
    },
    "score_level": {
      "items": {
        "$ref": "#/$defs/EnumValue"
      },
      "title": "Score Level",
      "type": "array"
    },
    "severity": {
      "items": {
        "$ref": "#/$defs/EnumValue"
      },
      "title": "Severity",
      "type": "array"
    },
    "source_status": {
      "items": {
        "$ref": "#/$defs/EnumValue"
      },
      "title": "Source Status",
      "type": "array"
    },
    "time_horizon": {
      "items": {
        "$ref": "#/$defs/EnumValue"
      },
      "title": "Time Horizon",
      "type": "array"
    },
    "undercount": {
      "description": "The standing sentence that reports are not impact.",
      "title": "Undercount",
      "type": "string"
    },
    "yield_reading": {
      "items": {
        "$ref": "#/$defs/EnumValue"
      },
      "title": "Yield Reading",
      "type": "array"
    }
  },
  "required": [
    "direction",
    "indicator_state",
    "bucket",
    "coverage_status",
    "scanability",
    "reliability",
    "credibility",
    "report_type",
    "score_level",
    "time_horizon",
    "finding_kind",
    "severity",
    "yield_reading",
    "disposition_outcome",
    "discipline",
    "source_status",
    "run_status",
    "history_kind",
    "product_level",
    "group_kind",
    "lens",
    "blind_spot_rule",
    "undercount"
  ],
  "title": "Enums",
  "type": "object"
}
